{
  "$schema": "http://json-schema.org/draft-07/schema#",
  "$ref": "#/definitions/SkillManifest",
  "definitions": {
    "Handle": {
      "type": "string",
      "allOf": [
        {
          "pattern": "^@[a-z0-9_](?:[a-z0-9_-]*[a-z0-9_])?$",
          "title": "Handle",
          "description": "A unique username or organization name starting with @, like @my-org.",
          "examples": ["@my-org", "@username"]
        }
      ]
    },
    "Version": {
      "type": "string",
      "allOf": [
        {
          "pattern": "^(0|[1-9]\\d*)\\.(0|[1-9]\\d*)\\.(0|[1-9]\\d*)(?:-((?:0|[1-9]\\d*|\\d*[a-zA-Z-][0-9a-zA-Z-]*)(?:\\.(?:0|[1-9]\\d*|\\d*[a-zA-Z-][0-9a-zA-Z-]*))*))?(?:\\+([0-9a-zA-Z-]+(?:\\.[0-9a-zA-Z-]+)*))?$",
          "title": "Version",
          "description": "A semver version like 1.0.0. Ranges are not allowed here.",
          "examples": ["1.0.0", "2.3.1", "0.1.0-beta.1"]
        }
      ]
    },
    "Repository": {
      "anyOf": [
        {
          "type": "string",
          "examples": ["https://github.com/acme/code-review", "github:acme/code-review"],
          "format": "uri-reference"
        },
        {
          "type": "object",
          "properties": {
            "type": {
              "anyOf": [
                {
                  "type": "string",
                  "allOf": [
                    {
                      "minLength": 1,
                      "description": "Version control system (e.g., `git`).",
                      "examples": ["git"]
                    }
                  ]
                },
                { "type": "null" }
              ]
            },
            "url": {
              "type": "string",
              "allOf": [
                {
                  "minLength": 1,
                  "description": "Repository URL.",
                  "examples": ["https://github.com/acme/code-review"],
                  "format": "uri"
                }
              ]
            },
            "directory": {
              "anyOf": [
                {
                  "type": "string",
                  "allOf": [
                    {
                      "minLength": 1,
                      "description": "Subdirectory within the repository, for monorepo publishers.",
                      "examples": ["packages/code-review"]
                    }
                  ]
                },
                { "type": "null" }
              ]
            }
          },
          "required": ["url"],
          "additionalProperties": false
        }
      ],
      "title": "Repository",
      "description": "Source repository for this extension. Accepts a URL string (or `host:owner/repo` shorthand) or an object with `type`, `url`, and optional `directory`."
    },
    "Bugs": {
      "anyOf": [
        {
          "type": "string",
          "examples": ["https://github.com/acme/code-review/issues"],
          "format": "uri"
        },
        {
          "type": "object",
          "properties": {
            "url": {
              "anyOf": [
                {
                  "type": "string",
                  "allOf": [
                    {
                      "minLength": 1,
                      "description": "Issue tracker URL.",
                      "examples": ["https://github.com/acme/code-review/issues"],
                      "format": "uri"
                    }
                  ]
                },
                { "type": "null" }
              ]
            },
            "email": {
              "anyOf": [
                {
                  "type": "string",
                  "allOf": [
                    {
                      "minLength": 1,
                      "description": "Contact email for bug reports.",
                      "examples": ["bugs@acme.dev"],
                      "format": "email"
                    }
                  ]
                },
                { "type": "null" }
              ]
            }
          },
          "additionalProperties": false
        }
      ],
      "title": "Bugs",
      "description": "Where to report bugs against this extension. Accepts a URL string or an object with optional `url` and `email`."
    },
    "Author": {
      "type": "object",
      "properties": {
        "name": { "type": "string" },
        "email": { "anyOf": [{ "type": "string" }, { "type": "null" }] },
        "url": { "anyOf": [{ "type": "string" }, { "type": "null" }] }
      },
      "required": ["name"],
      "additionalProperties": false,
      "title": "Author",
      "description": "A person credited as a creator or maintainer of this extension."
    },
    "PackageUrl": {
      "type": "string",
      "allOf": [
        {
          "pattern": "^[Pp][Kk][Gg]:[a-zA-Z][a-zA-Z0-9.+-]*\\/.+$",
          "title": "Package URL",
          "description": "A Package URL (purl) string identifying a package across ecosystems (e.g. pkg:npm/react@18.2.0).",
          "examples": ["pkg:npm/react@18.2.0", "pkg:pypi/requests@2.31.0", "pkg:cargo/serde@1.0"]
        }
      ]
    },
    "PackSpec": {
      "type": "string",
      "allOf": [
        { "minLength": 1 },
        {
          "pattern": "^(@[a-z0-9_](?:[a-z0-9_-]*[a-z0-9_])?)\\/packs\\/([a-z0-9](?:[a-z0-9-]{0,62}[a-z0-9])?)(?:@.+)?$",
          "title": "Pack Spec",
          "description": "Pack reference with an optional version constraint suffix.",
          "examples": ["@acme/packs/typescript", "@acme/packs/typescript@^1.0.0"]
        }
      ]
    },
    "ExtensionName": {
      "type": "string",
      "allOf": [
        { "minLength": 1 },
        {
          "pattern": "^[a-z0-9](?:[a-z0-9-]{0,62}[a-z0-9])?$",
          "title": "Extension Name",
          "description": "Short name for this skill within its owner namespace. Combined with owner, forms the FQN @owner/skills/<name>.",
          "examples": ["my-skill", "code-review", "prettier"]
        }
      ]
    },
    "SkillManifest": {
      "type": "object",
      "properties": {
        "$schema": { "anyOf": [{ "type": "string" }, { "type": "null" }] },
        "owner": { "$ref": "#/definitions/Handle" },
        "version": { "$ref": "#/definitions/Version" },
        "description": {
          "anyOf": [
            {
              "type": "string",
              "description": "Short, registry-facing summary of this extension shown in listings and search results."
            },
            { "type": "null" }
          ]
        },
        "keywords": {
          "anyOf": [
            {
              "type": "array",
              "examples": [["lint", "typescript", "review"]],
              "items": { "type": "string", "allOf": [{ "minLength": 1 }] }
            },
            { "type": "null" }
          ]
        },
        "repository": { "anyOf": [{ "$ref": "#/definitions/Repository" }, { "type": "null" }] },
        "homepage": {
          "anyOf": [
            { "type": "string", "examples": ["https://acme.dev/code-review"], "format": "uri" },
            { "type": "null" }
          ]
        },
        "license": {
          "anyOf": [
            { "type": "string", "allOf": [{ "minLength": 1, "examples": ["MIT", "Apache-2.0"] }] },
            { "type": "null" }
          ]
        },
        "bugs": { "anyOf": [{ "$ref": "#/definitions/Bugs" }, { "type": "null" }] },
        "authors": {
          "anyOf": [
            { "type": "array", "items": { "$ref": "#/definitions/Author" } },
            { "type": "null" }
          ]
        },
        "companionPackages": {
          "anyOf": [
            {
              "type": "array",
              "description": "External ecosystem packages this extension is designed to work with (e.g. the npm or PyPI package an MCP server wraps), identified by Package URL (purl).",
              "items": { "$ref": "#/definitions/PackageUrl" }
            },
            { "type": "null" }
          ]
        },
        "recommendedPacks": {
          "anyOf": [
            {
              "type": "array",
              "description": "Packs this extension is designed to work alongside. Each entry is a pack spec, optionally pinned to a version range.",
              "items": { "$ref": "#/definitions/PackSpec" }
            },
            { "type": "null" }
          ]
        },
        "standalone": {
          "anyOf": [
            {
              "type": "boolean",
              "description": "Set to false to indicate this extension only makes sense when installed alongside one of its recommendedPacks.",
              "default": true
            },
            { "type": "null" }
          ]
        },
        "type": { "type": "string", "enum": ["skill"] },
        "name": { "$ref": "#/definitions/ExtensionName" }
      },
      "required": ["owner", "version", "type", "name"],
      "additionalProperties": false,
      "title": "Skill Manifest",
      "description": "Extension manifest file for skill. Carries the registry-facing identity, version, and metadata."
    }
  }
}
