{
  "$schema": "https://axm.sh/schemas/skill.schema.json",
  "owner": "@craigsmitham",
  "type": "skill",
  "name": "effect-v4-structured-concurrency",
  "version": "0.1.0",
  "description": "Structures Effect v4 concurrency so child work has bounded lifetime and parallelism",
  "keywords": [
    "effect",
    "effect-v4",
    "typescript",
    "concurrency",
    "fibers"
  ],
  "recommendedPacks": [
    "@craigsmitham/packs/effect-v4"
  ],
  "repository": {
    "type": "git",
    "url": "https://github.com/craigsmitham/agent-extensions",
    "directory": ".axm/extensions/@craigsmitham/skills/effect-v4-structured-concurrency"
  },
  "homepage": "https://github.com/craigsmitham/agent-extensions",
  "license": "MIT"
}
