{
  "$schema": "https://axm.sh/schemas/skill.schema.json",
  "owner": "@examples",
  "type": "skill",
  "name": "ruby-rubygems-pawmatch-find-a-pet",
  "version": "0.1.0",
  "description": "Help an end user identify and apply for an adoptable pet using the PawMatch Ruby CLI.",
  "keywords": ["gem", "ruby", "rubygems", "pawmatch", "adoption", "cli"],
  "standalone": true
}
