{
  "$schema": "https://axm.sh/schemas/skill.schema.json",
  "owner": "@craigsmitham",
  "type": "skill",
  "name": "effect-v4-wrapping",
  "version": "0.1.0",
  "description": "Wraps Promise, callback, and third-party APIs as truthful Effect v4 boundaries",
  "keywords": ["effect", "effect-v4", "typescript", "promise", "callback", "adapter"],
  "recommendedPacks": ["@craigsmitham/packs/effect-v4"],
  "repository": {
    "type": "git",
    "url": "https://github.com/craigsmitham/agent-extensions",
    "directory": ".axm/extensions/@craigsmitham/skills/effect-v4-wrapping"
  },
  "homepage": "https://github.com/craigsmitham/agent-extensions",
  "license": "MIT"
}
