{
  "$schema": "https://axm.sh/schemas/skill.schema.json",
  "owner": "@craigsmitham",
  "type": "skill",
  "name": "audit-docs",
  "version": "0.1.0",
  "description": "Audit documentation collections for evidence-backed findings about quality, discovery, accuracy, coverage, and maintenance",
  "keywords": [
    "docs",
    "documentation",
    "audit",
    "quality",
    "discovery",
    "staleness",
    "coverage",
    "remediation"
  ],
  "recommendedPacks": ["@craigsmitham/packs/docs"],
  "standalone": false,
  "repository": {
    "type": "git",
    "url": "https://github.com/craigsmitham/agent-extensions",
    "directory": ".axm/extensions/@craigsmitham/skills/audit-docs"
  },
  "homepage": "https://github.com/craigsmitham/agent-extensions",
  "license": "MIT"
}
