{
  "$schema": "https://axm.sh/schemas/skill.schema.json",
  "owner": "@examples",
  "type": "skill",
  "name": "cpp-conan-tinyflags-rollout-review",
  "version": "0.1.0",
  "description": "Audit a TinyFlags flag's C++ callsites and rollout state before advancing the gate.",
  "keywords": ["cpp", "c++", "conan", "cmake", "feature-flags", "rollout", "review"],
  "companionPackages": ["pkg:conan/agentxm-example-tinyflags"],
  "recommendedPacks": ["@examples/packs/cpp-conan-tinyflags"],
  "standalone": false
}
