{
  "$schema": "https://axm.sh/schemas/skill.schema.json",
  "owner": "@examples",
  "type": "skill",
  "name": "r-cran-pawmatch-find-a-pet",
  "version": "0.1.0",
  "description": "Guide a user through the PawMatch pet-adoption CLI to shortlist and apply for an adoptable pet.",
  "keywords": ["r", "cran", "pawmatch", "adoption", "cli"],
  "standalone": true
}
