{
  "$schema": "https://axm.sh/schemas/skill.schema.json",
  "owner": "@craigsmitham",
  "type": "skill",
  "name": "effect-v4-resource-safety",
  "version": "0.1.0",
  "description": "Makes Effect v4 resource ownership and cleanup safe under failure and interruption",
  "keywords": [
    "effect",
    "effect-v4",
    "typescript",
    "resources",
    "scope"
  ],
  "recommendedPacks": [
    "@craigsmitham/packs/effect-v4"
  ],
  "repository": {
    "type": "git",
    "url": "https://github.com/craigsmitham/agent-extensions",
    "directory": ".axm/extensions/@craigsmitham/skills/effect-v4-resource-safety"
  },
  "homepage": "https://github.com/craigsmitham/agent-extensions",
  "license": "MIT"
}
