{
  "$schema": "https://axm.sh/schemas/skill.schema.json",
  "owner": "@examples",
  "type": "skill",
  "name": "dart-pub-tinyflags-cleanup-flag",
  "version": "0.1.0",
  "description": "Remove a stale TinyFlags flag from a Pub Dart project.",
  "keywords": ["pub", "dart", "feature-flags", "cleanup"],
  "companionPackages": ["pkg:pub/agentxm_example_tinyflags@^0.1.0"],
  "recommendedPacks": ["@examples/packs/dart-pub-tinyflags"],
  "standalone": false
}
