{
  "$schema": "https://axm.sh/schemas/skill.schema.json",
  "owner": "@craigsmitham",
  "type": "skill",
  "name": "manage-work-items",
  "version": "0.2.1",
  "description": "Creates and maintains evidence-aware Operational Incident Records, Defect Reports, and Changes across tracker hosts without imposing a delivery method",
  "keywords": [
    "work-management",
    "work-item",
    "issue",
    "ticket",
    "defect-report",
    "bug-report",
    "change-request",
    "bugfix",
    "operational-incident",
    "triage",
    "tracker"
  ],
  "repository": {
    "type": "git",
    "url": "https://github.com/craigsmitham/agent-extensions",
    "directory": "skills/manage-work-items"
  },
  "homepage": "https://github.com/craigsmitham/agent-extensions",
  "license": "MIT",
  "standalone": false,
  "recommendedPacks": [
    "@craigsmitham/packs/work-management"
  ]
}
