{
  "$schema": "https://axm.sh/schemas/skill.schema.json",
  "owner": "@examples",
  "type": "skill",
  "name": "composer-tinyflags-rollout-review",
  "version": "0.1.0",
  "description": "Review TinyFlags rollout safety in a Composer PHP project.",
  "keywords": ["composer", "php", "feature-flags", "rollout", "review"],
  "companionPackages": ["pkg:composer/agentxm/example-tinyflags@^0.1.0"],
  "recommendedPacks": ["@examples/packs/composer-tinyflags"],
  "standalone": false
}
