{
  "$schema": "https://axm.sh/schemas/skill.schema.json",
  "owner": "@craigsmitham",
  "type": "skill",
  "name": "setup-architecture-docs",
  "version": "0.5.0",
  "description": "Plan or establish discoverable, profile-conforming architecture-doc adoption with the required system-context kernel from accepted authority and explicit system-to-corpus mappings",
  "keywords": [
    "software-architecture",
    "architecture-docs",
    "architecture-documentation",
    "setup",
    "adoption",
    "assessment",
    "initialization",
    "federation",
    "just-enough-architecture-docs",
    "system-boundary",
    "system-lifecycle",
    "system-ownership",
    "decision-policy",
    "system-assurance",
    "stable-identity",
    "documentation"
  ],
  "repository": {
    "type": "git",
    "url": "https://github.com/craigsmitham/agent-extensions",
    "directory": ".axm/extensions/@craigsmitham/skills/setup-architecture-docs"
  },
  "homepage": "https://github.com/craigsmitham/agent-extensions",
  "license": "MIT",
  "recommendedPacks": ["@craigsmitham/packs/software-architecture"],
  "standalone": false
}
