{
  "$schema": "https://axm.sh/schemas/skill.schema.json",
  "owner": "@examples",
  "type": "skill",
  "name": "perl-cpan-tinyflags-add-flag",
  "version": "0.1.0",
  "description": "Wrap a Perl code path in a TinyFlags feature flag and scaffold its Test::More coverage.",
  "keywords": ["cpan", "perl", "feature-flags", "tinyflags"],
  "companionPackages": ["pkg:cpan/AgentXM-Examples-TinyFlags@^0.1.0"],
  "recommendedPacks": ["@examples/packs/perl-cpan-tinyflags"],
  "standalone": false
}
