{
  "$schema": "https://axm.sh/schemas/skill.schema.json",
  "owner": "@examples",
  "type": "skill",
  "name": "maven-scala-tinyflags-add-flag",
  "version": "0.1.0",
  "description": "Add a TinyFlags flag to a Maven Scala project with tests.",
  "keywords": ["maven", "scala", "scala3", "jvm", "feature-flags", "tinyflags"],
  "companionPackages": ["pkg:maven/ai.agentxm.examples/tinyflags-scala_3@^0.1.0"],
  "recommendedPacks": ["@examples/packs/maven-scala-tinyflags"],
  "standalone": false
}
