{
  "$schema": "https://axm.sh/schemas/skill.schema.json",
  "owner": "@examples",
  "type": "skill",
  "name": "typescript-jsr-tinyflags-add-flag",
  "version": "0.1.0",
  "description": "Wrap a TypeScript code path in a TinyFlags feature flag and scaffold its Deno test coverage.",
  "keywords": ["jsr", "deno", "typescript", "feature-flags", "tinyflags"],
  "companionPackages": ["pkg:generic/jsr/%40agentxm/example-tinyflags@0.1.0"],
  "recommendedPacks": ["@examples/packs/typescript-jsr-tinyflags"],
  "standalone": false
}
